{
  "format": "riff-spaced/library",
  "version": 1,
  "exportedAt": "2026-10-24T20:00:00Z",
  "riffs": [
    {
      "format": "riff-spaced/riff",
      "version": 1,
      "id": "demo-riff-walkdown",
      "name": "Walkdown Turnaround",
      "createdAt": "2026-10-24T20:00:00Z",
      "updatedAt": "2026-10-24T20:00:00Z",
      "tuning": {
        "name": "Bb Standard",
        "pitches": [34, 39, 44, 49, 53, 58]
      },
      "tempo": {
        "bpm": 92
      },
      "timeSignature": {
        "beats": 4,
        "unit": 4
      },
      "ppq": 480,
      "lengthBars": 4,
      "sections": [
        {
          "id": "demo-walkdown-s1",
          "label": "A",
          "startBar": 0,
          "lengthBars": 4,
          "kind": "main"
        }
      ],
      "notes": [
        {
          "id": "wd-n01",
          "string": 6,
          "fret": 0,
          "start": 0,
          "duration": 240,
          "velocity": 100,
          "techniques": ["palmMute"]
        },
        {
          "id": "wd-n02",
          "string": 6,
          "fret": 3,
          "start": 240,
          "duration": 240,
          "velocity": 100,
          "techniques": ["palmMute"],
          "chordId": "wd-c01"
        },
        {
          "id": "wd-n03",
          "string": 5,
          "fret": 5,
          "start": 240,
          "duration": 240,
          "velocity": 100,
          "techniques": ["palmMute"],
          "chordId": "wd-c01"
        },
        {
          "id": "wd-n04",
          "string": 6,
          "fret": 3,
          "start": 480,
          "duration": 240,
          "velocity": 100,
          "techniques": ["palmMute"],
          "chordId": "wd-c02"
        },
        {
          "id": "wd-n05",
          "string": 5,
          "fret": 5,
          "start": 480,
          "duration": 240,
          "velocity": 100,
          "techniques": ["palmMute"],
          "chordId": "wd-c02"
        },
        {
          "id": "wd-n06",
          "string": 6,
          "fret": 3,
          "start": 720,
          "duration": 240,
          "velocity": 100,
          "techniques": ["palmMute"],
          "chordId": "wd-c03"
        },
        {
          "id": "wd-n07",
          "string": 5,
          "fret": 5,
          "start": 720,
          "duration": 240,
          "velocity": 100,
          "techniques": ["palmMute"],
          "chordId": "wd-c03"
        },
        {
          "id": "wd-n08",
          "string": 6,
          "fret": 3,
          "start": 960,
          "duration": 240,
          "velocity": 100,
          "techniques": ["palmMute"],
          "chordId": "wd-c04"
        },
        {
          "id": "wd-n09",
          "string": 5,
          "fret": 5,
          "start": 960,
          "duration": 240,
          "velocity": 100,
          "techniques": ["palmMute"],
          "chordId": "wd-c04"
        },
        {
          "id": "wd-n10",
          "string": 6,
          "fret": 3,
          "start": 1200,
          "duration": 240,
          "velocity": 100,
          "techniques": ["palmMute"],
          "chordId": "wd-c05"
        },
        {
          "id": "wd-n11",
          "string": 5,
          "fret": 5,
          "start": 1200,
          "duration": 240,
          "velocity": 100,
          "techniques": ["palmMute"],
          "chordId": "wd-c05"
        },
        {
          "id": "wd-n12",
          "string": 6,
          "fret": 3,
          "start": 1440,
          "duration": 240,
          "velocity": 100,
          "techniques": ["palmMute"],
          "chordId": "wd-c06"
        },
        {
          "id": "wd-n13",
          "string": 5,
          "fret": 5,
          "start": 1440,
          "duration": 240,
          "velocity": 100,
          "techniques": ["palmMute"],
          "chordId": "wd-c06"
        },
        {
          "id": "wd-n14",
          "string": 5,
          "fret": 5,
          "start": 1680,
          "duration": 240,
          "velocity": 100,
          "techniques": ["palmMute"],
          "chordId": "wd-c07"
        },
        {
          "id": "wd-n15",
          "string": 4,
          "fret": 5,
          "start": 1680,
          "duration": 240,
          "velocity": 100,
          "techniques": ["palmMute"],
          "chordId": "wd-c07"
        },
        {
          "id": "wd-n16",
          "string": 6,
          "fret": 3,
          "start": 1920,
          "duration": 240,
          "velocity": 100,
          "techniques": ["palmMute"],
          "chordId": "wd-c08"
        },
        {
          "id": "wd-n17",
          "string": 5,
          "fret": 5,
          "start": 1920,
          "duration": 240,
          "velocity": 100,
          "techniques": ["palmMute"],
          "chordId": "wd-c08"
        },
        {
          "id": "wd-n18",
          "string": 6,
          "fret": 3,
          "start": 2160,
          "duration": 240,
          "velocity": 100,
          "techniques": ["palmMute"],
          "chordId": "wd-c09"
        },
        {
          "id": "wd-n19",
          "string": 5,
          "fret": 5,
          "start": 2160,
          "duration": 240,
          "velocity": 100,
          "techniques": ["palmMute"],
          "chordId": "wd-c09"
        },
        {
          "id": "wd-n20",
          "string": 6,
          "fret": 3,
          "start": 2400,
          "duration": 240,
          "velocity": 100,
          "techniques": ["palmMute"],
          "chordId": "wd-c10"
        },
        {
          "id": "wd-n21",
          "string": 5,
          "fret": 5,
          "start": 2400,
          "duration": 240,
          "velocity": 100,
          "techniques": ["palmMute"],
          "chordId": "wd-c10"
        },
        {
          "id": "wd-n22",
          "string": 6,
          "fret": 3,
          "start": 2640,
          "duration": 240,
          "velocity": 100,
          "techniques": ["palmMute"],
          "chordId": "wd-c11"
        },
        {
          "id": "wd-n23",
          "string": 5,
          "fret": 5,
          "start": 2640,
          "duration": 240,
          "velocity": 100,
          "techniques": ["palmMute"],
          "chordId": "wd-c11"
        },
        {
          "id": "wd-n24",
          "string": 6,
          "fret": 3,
          "start": 2880,
          "duration": 240,
          "velocity": 100,
          "techniques": ["palmMute"],
          "chordId": "wd-c12"
        },
        {
          "id": "wd-n25",
          "string": 5,
          "fret": 5,
          "start": 2880,
          "duration": 240,
          "velocity": 100,
          "techniques": ["palmMute"],
          "chordId": "wd-c12"
        },
        {
          "id": "wd-n26",
          "string": 6,
          "fret": 3,
          "start": 3120,
          "duration": 240,
          "velocity": 100,
          "techniques": ["palmMute"],
          "chordId": "wd-c13"
        },
        {
          "id": "wd-n27",
          "string": 5,
          "fret": 5,
          "start": 3120,
          "duration": 240,
          "velocity": 100,
          "techniques": ["palmMute"],
          "chordId": "wd-c13"
        },
        {
          "id": "wd-n28",
          "string": 6,
          "fret": 3,
          "start": 3360,
          "duration": 240,
          "velocity": 100,
          "techniques": ["palmMute"],
          "chordId": "wd-c14"
        },
        {
          "id": "wd-n29",
          "string": 5,
          "fret": 5,
          "start": 3360,
          "duration": 240,
          "velocity": 100,
          "techniques": ["palmMute"],
          "chordId": "wd-c14"
        },
        {
          "id": "wd-n30",
          "string": 5,
          "fret": 5,
          "start": 3600,
          "duration": 240,
          "velocity": 100,
          "techniques": ["palmMute"],
          "chordId": "wd-c15"
        },
        {
          "id": "wd-n31",
          "string": 4,
          "fret": 5,
          "start": 3600,
          "duration": 240,
          "velocity": 100,
          "techniques": ["palmMute"],
          "chordId": "wd-c15"
        },
        {
          "id": "wd-n32",
          "string": 6,
          "fret": 3,
          "start": 3840,
          "duration": 240,
          "velocity": 100,
          "techniques": ["palmMute"],
          "chordId": "wd-c16"
        },
        {
          "id": "wd-n33",
          "string": 5,
          "fret": 5,
          "start": 3840,
          "duration": 240,
          "velocity": 100,
          "techniques": ["palmMute"],
          "chordId": "wd-c16"
        },
        {
          "id": "wd-n34",
          "string": 6,
          "fret": 3,
          "start": 4080,
          "duration": 240,
          "velocity": 100,
          "techniques": ["palmMute"],
          "chordId": "wd-c17"
        },
        {
          "id": "wd-n35",
          "string": 5,
          "fret": 5,
          "start": 4080,
          "duration": 240,
          "velocity": 100,
          "techniques": ["palmMute"],
          "chordId": "wd-c17"
        },
        {
          "id": "wd-n36",
          "string": 6,
          "fret": 3,
          "start": 4320,
          "duration": 240,
          "velocity": 100,
          "techniques": ["palmMute"],
          "chordId": "wd-c18"
        },
        {
          "id": "wd-n37",
          "string": 5,
          "fret": 5,
          "start": 4320,
          "duration": 240,
          "velocity": 100,
          "techniques": ["palmMute"],
          "chordId": "wd-c18"
        },
        {
          "id": "wd-n38",
          "string": 6,
          "fret": 3,
          "start": 4560,
          "duration": 240,
          "velocity": 100,
          "techniques": ["palmMute"],
          "chordId": "wd-c19"
        },
        {
          "id": "wd-n39",
          "string": 5,
          "fret": 5,
          "start": 4560,
          "duration": 240,
          "velocity": 100,
          "techniques": ["palmMute"],